13:31:40.853051 IP 192.168.0.162.ssh > 192.168.0.82.64615: Flags [P.], seq 2830333941:2830334085, ack 868814530, win 430, length 144
13:31:40.858183 IP 192.168.0.82.64615 > 192.168.0.162.ssh: Flags [.], ack 144, win 16357, length 0
13:31:41.754980 ba:27:eb:c6:02:3a (oui Unknown) > b8:27:eb:c6:02:3a (oui Unknown), ethertype Unknown (0x886c), length 150: 
	0x0000:  8001 00b4 0000 1018 0001 0002 0000 0000  ................
	0x0010:  002c 0000 0000 0000 0000 0000 0000 0000  .,..............
	0x0020:  004c a4db 30ac ffad 776c 3000 0000 0000  .L..0...wl0.....
	0x0030:  0000 0000 0000 0000 0000 4000 0000 ffff  ..........@.....
	0x0040:  ffff ffff a4db 30ac ffad ffff ffff ffff  ......0.........
	0x0050:  00df 0006 7a65 6e64 7269 0108 8284 8b96  ....zendri......
	0x0060:  0c12 1824 3204 3048 606c 2d1a 6e01 03ff  ...$2.0H`l-.n...
	0x0070:  0000 0000 0000 0000 0000 0000 0000 0000  ................
	0x0080:  0000 0000 0000 0000                      ........
13:31:41.774751 ba:27:eb:c6:02:3a (oui Unknown) > b8:27:eb:c6:02:3a (oui Unknown), ethertype Unknown (0x886c), length 150: 
	0x0000:  8001 00b4 0000 1018 0001 0002 0000 0000  ................
	0x0010:  002c 0000 0000 0000 0000 0000 0000 0000  .,..............
	0x0020:  004c a4db 30ac ffad 776c 3000 0000 0000  .L..0...wl0.....
	0x0030:  0000 0000 0000 0000 0000 4000 0000 ffff  ..........@.....
	0x0040:  ffff ffff a4db 30ac ffad ffff ffff ffff  ......0.........
	0x0050:  10df 0006 7a65 6e64 7269 0108 8284 8b96  ....zendri......
	0x0060:  0c12 1824 3204 3048 606c 2d1a 6e01 03ff  ...$2.0H`l-.n...
	0x0070:  0000 0000 0000 0000 0000 0000 0000 0000  ................
	0x0080:  0000 0000 0000 0000                      ........
13:31:44.837857 ARP, Request who-has 192.168.0.14 tell 192.168.0.82, length 46
13:31:46.066299 IP 192.168.0.171.17500 > 255.255.255.255.17500: UDP, length 242
13:31:46.066505 IP 192.168.0.171.17500 > 192.168.0.255.17500: UDP, length 242
13:31:46.325069 ba:27:eb:c6:02:3a (oui Unknown) > b8:27:eb:c6:02:3a (oui Unknown), ethertype Unknown (0x886c), length 150: 
	0x0000:  8001 00b4 0000 1018 0001 0002 0000 0000  ................
	0x0010:  002c 0000 0000 0000 0000 0000 0000 0000  .,..............
	0x0020:  004c a4db 30ac ffad 776c 3000 0000 0000  .L..0...wl0.....
	0x0030:  0000 0000 0000 0000 0000 4000 0000 ffff  ..........@.....
	0x0040:  ffff ffff a4db 30ac ffad ffff ffff ffff  ......0.........
	0x0050:  00e1 0006 7a65 6e64 7269 0108 8284 8b96  ....zendri......
	0x0060:  0c12 1824 3204 3048 606c 2d1a 6e01 03ff  ...$2.0H`l-.n...
	0x0070:  0000 0000 0000 0000 0000 0000 0000 0000  ................
	0x0080:  0000 0000 0000 0000                      ........
13:31:49.733850 ba:27:eb:c6:02:3a (oui Unknown) > b8:27:eb:c6:02:3a (oui Unknown), ethertype Unknown (0x886c), length 116: 
	0x0000:  8001 0092 0000 1018 0001 0002 0000 0000  ................
	0x0010:  002c 0000 0000 0000 0000 0000 0000 0000  .,..............
	0x0020:  002a 001c bf73 3c51 776c 3000 0000 0000  .*...s<Qwl0.....
	0x0030:  0000 0000 0000 0000 0000 4000 0000 ffff  ..........@.....
	0x0040:  ffff ffff 001c bf73 3c51 ffff ffff ffff  .......s<Q......
	0x0050:  8021 0000 0108 0204 0b16 0c12 1824 3204  .!...........$2.
	0x0060:  3048 606c 0000                           0H`l..
13:31:49.737411 ba:27:eb:c6:02:3a (oui Unknown) > b8:27:eb:c6:02:3a (oui Unknown), ethertype Unknown (0x886c), length 116: 
	0x0000:  8001 0092 0000 1018 0001 0002 0000 0000  ................
	0x0010:  002c 0000 0000 0000 0000 0000 0000 0000  .,..............
	0x0020:  002a 001c bf73 3c51 776c 3000 0000 0000  .*...s<Qwl0.....
	0x0030:  0000 0000 0000 0000 0000 4000 0000 ffff  ..........@.....
	0x0040:  ffff ffff 001c bf73 3c51 ffff ffff ffff  .......s<Q......
	0x0050:  9021 0000 0108 0204 0b16 0c12 1824 3204  .!...........$2.
	0x0060:  3048 606c 0000                           0H`l..
13:31:49.750163 ba:27:eb:c6:02:3a (oui Unknown) > b8:27:eb:c6:02:3a (oui Unknown), ethertype Unknown (0x886c), length 116: 
	0x0000:  8001 0092 0000 1018 0001 0002 0000 0000  ................
	0x0010:  002c 0000 0000 0000 0000 0000 0000 0000  .,..............
	0x0020:  002a 001c bf73 3c51 776c 3000 0000 0000  .*...s<Qwl0.....
	0x0030:  0000 0000 0000 0000 0000 4000 0000 ffff  ..........@.....
	0x0040:  ffff ffff 001c bf73 3c51 ffff ffff ffff  .......s<Q......
	0x0050:  a021 0000 0108 0204 0b16 0c12 1824 3204  .!...........$2.
	0x0060:  3048 606c 0000                           0H`l..
13:31:49.775469 ba:27:eb:c6:02:3a (oui Unknown) > b8:27:eb:c6:02:3a (oui Unknown), ethertype Unknown (0x886c), length 116: 
	0x0000:  8001 0092 0000 1018 0001 0002 0000 0000  ................
	0x0010:  002c 0000 0000 0000 0000 0000 0000 0000  .,..............
	0x0020:  002a 001c bf73 3c51 776c 3000 0000 0000  .*...s<Qwl0.....
	0x0030:  0000 0000 0000 0000 0000 4000 0000 ffff  ..........@.....
	0x0040:  ffff ffff 001c bf73 3c51 ffff ffff ffff  .......s<Q......
	0x0050:  b021 0000 0108 0204 0b16 0c12 1824 3204  .!...........$2.
	0x0060:  3048 606c 0000                           0H`l..
13:31:51.957923 ba:27:eb:c6:02:3a (oui Unknown) > b8:27:eb:c6:02:3a (oui Unknown), ethertype Unknown (0x886c), length 323: 
	0x0000:  8001 0161 0000 1018 0001 0002 0000 0000  ...a............
	0x0010:  002c 0000 0000 0000 0000 0000 0000 0000  .,..............
	0x0020:  00f9 7cdd 904c 9b85 776c 3000 0000 0000  ..|..L..wl0.....
	0x0030:  0000 0000 0000 0000 0000 4000 0000 ffff  ..........@.....
	0x0040:  ffff ffff 7cdd 904c 9b85 ffff ffff ffff  ....|..L........
	0x0050:  704a 0000 0108 8284 8b96 1224 486c 3204  pJ.........$Hl2.
	0x0060:  0c18 3060 2d1a 0c01 02ff 0000 0000 0000  ..0`-...........
	0x0070:  0000 0000 0000 0000 0000 0e00 0000 0000  ................
	0x0080:  7f08 0100 0000 0000 0000 dda7 0050 f204  .............P..
	0x0090:  104a 0001 1010 3a00 0100 1008 0002 228c  .J....:.......".
	0x00a0:  1048 0010 5261 6c69 6e6b 5750 532d 7cdd  .H..RalinkWPS-|.
	0x00b0:  904c 9b85 1054 0008 0001 0050 f204 0001  .L...T.....P....
	0x00c0:  103c 0001 0110 0200 0200 0010 0900 0200  .<..............
	0x00d0:  0010 1200 0200 0010 1100 0d52 616c 696e  ...........Ralin
	0x00e0:  6b2d 436c 6965 6e74 1021 0018 5261 6c69  k-Client.!..Rali
	0x00f0:  6e6b 2054 6563 686e 6f6c 6f67 792c 2043  nk.Technology,.C
	0x0100:  6f72 702e 1023 0017 5261 6c69 6e6b 2057  orp..#..Ralink.W
	0x0110:  6972 656c 6573 7320 4164 6170 7465 7210  ireless.Adapter.
	0x0120:  2400 0652 5432 3837 3010 4900 0600 372a  $..RT2870.I...7*
	0x0130:  0001 2000 00                             .....
13:31:52.047382 ba:27:eb:c6:02:3a (oui Unknown) > b8:27:eb:c6:02:3a (oui Unknown), ethertype Unknown (0x886c), length 323: 
	0x0000:  8001 0161 0000 1018 0001 0002 0000 0000  ...a............
	0x0010:  002c 0000 0000 0000 0000 0000 0000 0000  .,..............
	0x0020:  00f9 7cdd 904c 9b85 776c 3000 0000 0000  ..|..L..wl0.....
	0x0030:  0000 0000 0000 0000 0000 4000 0000 ffff  ..........@.....
	0x0040:  ffff ffff 7cdd 904c 9b85 ffff ffff ffff  ....|..L........
	0x0050:  804a 0000 0108 8284 8b96 1224 486c 3204  .J.........$Hl2.
	0x0060:  0c18 3060 2d1a 0c01 02ff 0000 0000 0000  ..0`-...........
	0x0070:  0000 0000 0000 0000 0000 0e00 0000 0000  ................
	0x0080:  7f08 0100 0000 0000 0000 dda7 0050 f204  .............P..
	0x0090:  104a 0001 1010 3a00 0100 1008 0002 228c  .J....:.......".
	0x00a0:  1048 0010 5261 6c69 6e6b 5750 532d 7cdd  .H..RalinkWPS-|.
	0x00b0:  904c 9b85 1054 0008 0001 0050 f204 0001  .L...T.....P....
	0x00c0:  103c 0001 0110 0200 0200 0010 0900 0200  .<..............
	0x00d0:  0010 1200 0200 0010 1100 0d52 616c 696e  ...........Ralin
	0x00e0:  6b2d 436c 6965 6e74 1021 0018 5261 6c69  k-Client.!..Rali
	0x00f0:  6e6b 2054 6563 686e 6f6c 6f67 792c 2043  nk.Technology,.C
	0x0100:  6f72 702e 1023 0017 5261 6c69 6e6b 2057  orp..#..Ralink.W
	0x0110:  6972 656c 6573 7320 4164 6170 7465 7210  ireless.Adapter.
	0x0120:  2400 0652 5432 3837 3010 4900 0600 372a  $..RT2870.I...7*
	0x0130:  0001 2000 00                             .....
13:31:52.289869 ba:27:eb:c6:02:3a (oui Unknown) > b8:27:eb:c6:02:3a (oui Unknown), ethertype Unknown (0x886c), length 323: 
	0x0000:  8001 0161 0000 1018 0001 0002 0000 0000  ...a............
	0x0010:  002c 0000 0000 0000 0000 0000 0000 0000  .,..............
	0x0020:  00f9 7cdd 904c 9b85 776c 3000 0000 0000  ..|..L..wl0.....
	0x0030:  0000 0000 0000 0000 0000 4000 0000 ffff  ..........@.....
	0x0040:  ffff ffff 7cdd 904c 9b85 ffff ffff ffff  ....|..L........
	0x0050:  b04a 0000 0108 8284 8b96 1224 486c 3204  .J.........$Hl2.
	0x0060:  0c18 3060 2d1a 0c01 02ff 0000 0000 0000  ..0`-...........
	0x0070:  0000 0000 0000 0000 0000 0e00 0000 0000  ................
	0x0080:  7f08 0100 0000 0000 0000 dda7 0050 f204  .............P..
	0x0090:  104a 0001 1010 3a00 0100 1008 0002 228c  .J....:.......".
	0x00a0:  1048 0010 5261 6c69 6e6b 5750 532d 7cdd  .H..RalinkWPS-|.
	0x00b0:  904c 9b85 1054 0008 0001 0050 f204 0001  .L...T.....P....
	0x00c0:  103c 0001 0110 0200 0200 0010 0900 0200  .<..............
	0x00d0:  0010 1200 0200 0010 1100 0d52 616c 696e  ...........Ralin
	0x00e0:  6b2d 436c 6965 6e74 1021 0018 5261 6c69  k-Client.!..Rali
	0x00f0:  6e6b 2054 6563 686e 6f6c 6f67 792c 2043  nk.Technology,.C
	0x0100:  6f72 702e 1023 0017 5261 6c69 6e6b 2057  orp..#..Ralink.W
	0x0110:  6972 656c 6573 7320 4164 6170 7465 7210  ireless.Adapter.
	0x0120:  2400 0652 5432 3837 3010 4900 0600 372a  $..RT2870.I...7*
	0x0130:  0001 2000 00                             .....
13:31:52.371806 ba:27:eb:c6:02:3a (oui Unknown) > b8:27:eb:c6:02:3a (oui Unknown), ethertype Unknown (0x886c), length 323: 
	0x0000:  8001 0161 0000 1018 0001 0002 0000 0000  ...a............
	0x0010:  002c 0000 0000 0000 0000 0000 0000 0000  .,..............
	0x0020:  00f9 7cdd 904c 9b85 776c 3000 0000 0000  ..|..L..wl0.....
	0x0030:  0000 0000 0000 0000 0000 4000 0000 ffff  ..........@.....
	0x0040:  ffff ffff 7cdd 904c 9b85 ffff ffff ffff  ....|..L........
	0x0050:  c04a 0000 0108 8284 8b96 1224 486c 3204  .J.........$Hl2.
	0x0060:  0c18 3060 2d1a 0c01 02ff 0000 0000 0000  ..0`-...........
	0x0070:  0000 0000 0000 0000 0000 0e00 0000 0000  ................
	0x0080:  7f08 0100 0000 0000 0000 dda7 0050 f204  .............P..
	0x0090:  104a 0001 1010 3a00 0100 1008 0002 228c  .J....:.......".
	0x00a0:  1048 0010 5261 6c69 6e6b 5750 532d 7cdd  .H..RalinkWPS-|.
	0x00b0:  904c 9b85 1054 0008 0001 0050 f204 0001  .L...T.....P....
	0x00c0:  103c 0001 0110 0200 0200 0010 0900 0200  .<..............
	0x00d0:  0010 1200 0200 0010 1100 0d52 616c 696e  ...........Ralin
	0x00e0:  6b2d 436c 6965 6e74 1021 0018 5261 6c69  k-Client.!..Rali
	0x00f0:  6e6b 2054 6563 686e 6f6c 6f67 792c 2043  nk.Technology,.C
	0x0100:  6f72 702e 1023 0017 5261 6c69 6e6b 2057  orp..#..Ralink.W
	0x0110:  6972 656c 6573 7320 4164 6170 7465 7210  ireless.Adapter.
	0x0120:  2400 0652 5432 3837 3010 4900 0600 372a  $..RT2870.I...7*
	0x0130:  0001 2000 00                             .....
13:31:52.458930 ba:27:eb:c6:02:3a (oui Unknown) > b8:27:eb:c6:02:3a (oui Unknown), ethertype Unknown (0x886c), length 323: 
	0x0000:  8001 0161 0000 1018 0001 0002 0000 0000  ...a............
	0x0010:  002c 0000 0000 0000 0000 0000 0000 0000  .,..............
	0x0020:  00f9 7cdd 904c 9b85 776c 3000 0000 0000  ..|..L..wl0.....
	0x0030:  0000 0000 0000 0000 0000 4000 0000 ffff  ..........@.....
	0x0040:  ffff ffff 7cdd 904c 9b85 ffff ffff ffff  ....|..L........
	0x0050:  d04a 0000 0108 8284 8b96 1224 486c 3204  .J.........$Hl2.
	0x0060:  0c18 3060 2d1a 0c01 02ff 0000 0000 0000  ..0`-...........
	0x0070:  0000 0000 0000 0000 0000 0e00 0000 0000  ................
	0x0080:  7f08 0100 0000 0000 0000 dda7 0050 f204  .............P..
	0x0090:  104a 0001 1010 3a00 0100 1008 0002 228c  .J....:.......".
	0x00a0:  1048 0010 5261 6c69 6e6b 5750 532d 7cdd  .H..RalinkWPS-|.
	0x00b0:  904c 9b85 1054 0008 0001 0050 f204 0001  .L...T.....P....
	0x00c0:  103c 0001 0110 0200 0200 0010 0900 0200  .<..............
	0x00d0:  0010 1200 0200 0010 1100 0d52 616c 696e  ...........Ralin
	0x00e0:  6b2d 436c 6965 6e74 1021 0018 5261 6c69  k-Client.!..Rali
	0x00f0:  6e6b 2054 6563 686e 6f6c 6f67 792c 2043  nk.Technology,.C
	0x0100:  6f72 702e 1023 0017 5261 6c69 6e6b 2057  orp..#..Ralink.W
	0x0110:  6972 656c 6573 7320 4164 6170 7465 7210  ireless.Adapter.
	0x0120:  2400 0652 5432 3837 3010 4900 0600 372a  $..RT2870.I...7*
	0x0130:  0001 2000 00                             .....
13:31:53.843338 ba:27:eb:c6:02:3a (oui Unknown) > b8:27:eb:c6:02:3a (oui Unknown), ethertype Unknown (0x886c), length 144: 
	0x0000:  8001 00ae 0000 1018 0001 0002 0000 0000  ................
	0x0010:  002c 0000 0000 0000 0000 0000 0000 0000  .,..............
	0x0020:  0046 3ca9 f45e db60 776c 3000 0000 0000  .F<..^.`wl0.....
	0x0030:  0000 0000 0000 0000 0000 4000 0000 ffff  ..........@.....
	0x0040:  ffff ffff 3ca9 f45e db60 ffff ffff ffff  ....<..^.`......
	0x0050:  e03c 0000 0108 0204 0b16 0c12 1824 3204  .<...........$2.
	0x0060:  3048 606c 2d1a 3009 17ff ffff 0000 0000  0H`l-.0.........
	0x0070:  0000 0000 0000 0000 0000 0000 0000 0000  ................
	0x0080:  0000                                     ..
13:31:53.877103 ba:27:eb:c6:02:3a (oui Unknown) > b8:27:eb:c6:02:3a (oui Unknown), ethertype Unknown (0x886c), length 152: 
	0x0000:  8001 00b6 0000 1018 0001 0002 0000 0000  ................
	0x0010:  002c 0000 0000 0000 0000 0000 0000 0000  .,..............
	0x0020:  004e 3ca9 f45e db60 776c 3000 0000 0000  .N<..^.`wl0.....
	0x0030:  0000 0000 0000 0000 0000 4000 0000 ffff  ..........@.....
	0x0040:  ffff ffff 3ca9 f45e db60 ffff ffff ffff  ....<..^.`......
	0x0050:  103d 0008 5365 7469 6373 2032 0108 0204  .=..Setics.2....
	0x0060:  0b16 0c12 1824 3204 3048 606c 2d1a 3009  .....$2.0H`l-.0.
	0x0070:  17ff ffff 0000 0000 0000 0000 0000 0000  ................
	0x0080:  0000 0000 0000 0000 0000                 ..........
13:31:53.877200 ba:27:eb:c6:02:3a (oui Unknown) > b8:27:eb:c6:02:3a (oui Unknown), ethertype Unknown (0x886c), length 144: 
	0x0000:  8001 00ae 0000 1018 0001 0002 0000 0000  ................
	0x0010:  002c 0000 0000 0000 0000 0000 0000 0000  .,..............
	0x0020:  0046 3ca9 f45e db60 776c 3000 0000 0000  .F<..^.`wl0.....
	0x0030:  0000 0000 0000 0000 0000 4000 0000 ffff  ..........@.....
	0x0040:  ffff ffff 3ca9 f45e db60 ffff ffff ffff  ....<..^.`......
	0x0050:  203d 0000 0108 0204 0b16 0c12 1824 3204  .=...........$2.
	0x0060:  3048 606c 2d1a 3009 17ff ffff 0000 0000  0H`l-.0.........
	0x0070:  0000 0000 0000 0000 0000 0000 0000 0000  ................
	0x0080:  0000                                     ..
13:31:53.941236 ba:27:eb:c6:02:3a (oui Unknown) > b8:27:eb:c6:02:3a (oui Unknown), ethertype Unknown (0x886c), length 144: 
	0x0000:  8001 00ae 0000 1018 0001 0002 0000 0000  ................
	0x0010:  002c 0000 0000 0000 0000 0000 0000 0000  .,..............
	0x0020:  0046 3ca9 f45e db60 776c 3000 0000 0000  .F<..^.`wl0.....
	0x0030:  0000 0000 0000 0000 0000 4000 0000 ffff  ..........@.....
	0x0040:  ffff ffff 3ca9 f45e db60 ffff ffff ffff  ....<..^.`......
	0x0050:  503d 0000 0108 0204 0b16 0c12 1824 3204  P=...........$2.
	0x0060:  3048 606c 2d1a 3009 17ff ffff 0000 0000  0H`l-.0.........
	0x0070:  0000 0000 0000 0000 0000 0000 0000 0000  ................
	0x0080:  0000                                     ..
13:31:53.943207 ba:27:eb:c6:02:3a (oui Unknown) > b8:27:eb:c6:02:3a (oui Unknown), ethertype Unknown (0x886c), length 144: 
	0x0000:  8001 00ae 0000 1018 0001 0002 0000 0000  ................
	0x0010:  002c 0000 0000 0000 0000 0000 0000 0000  .,..............
	0x0020:  0046 3ca9 f45e db60 776c 3000 0000 0000  .F<..^.`wl0.....
	0x0030:  0000 0000 0000 0000 0000 4000 0000 ffff  ..........@.....
	0x0040:  ffff ffff 3ca9 f45e db60 ffff ffff ffff  ....<..^.`......
	0x0050:  703d 0000 0108 0204 0b16 0c12 1824 3204  p=...........$2.
	0x0060:  3048 606c 2d1a 3009 17ff ffff 0000 0000  0H`l-.0.........
	0x0070:  0000 0000 0000 0000 0000 0000 0000 0000  ................
	0x0080:  0000                                     ..
13:31:54.042308 ba:27:eb:c6:02:3a (oui Unknown) > b8:27:eb:c6:02:3a (oui Unknown), ethertype Unknown (0x886c), length 144: 
	0x0000:  8001 00ae 0000 1018 0001 0002 0000 0000  ................
	0x0010:  002c 0000 0000 0000 0000 0000 0000 0000  .,..............
	0x0020:  0046 3ca9 f45e db60 776c 3000 0000 0000  .F<..^.`wl0.....
	0x0030:  0000 0000 0000 0000 0000 4000 0000 ffff  ..........@.....
	0x0040:  ffff ffff 3ca9 f45e db60 ffff ffff ffff  ....<..^.`......
	0x0050:  e03d 0000 0108 0204 0b16 0c12 1824 3204  .=...........$2.
	0x0060:  3048 606c 2d1a 3009 17ff ffff 0000 0000  0H`l-.0.........
	0x0070:  0000 0000 0000 0000 0000 0000 0000 0000  ................
	0x0080:  0000                                     ..
13:31:54.042403 ba:27:eb:c6:02:3a (oui Unknown) > b8:27:eb:c6:02:3a (oui Unknown), ethertype Unknown (0x886c), length 152: 
	0x0000:  8001 00b6 0000 1018 0001 0002 0000 0000  ................
	0x0010:  002c 0000 0000 0000 0000 0000 0000 0000  .,..............
	0x0020:  004e 3ca9 f45e db60 776c 3000 0000 0000  .N<..^.`wl0.....
	0x0030:  0000 0000 0000 0000 0000 4000 0000 ffff  ..........@.....
	0x0040:  ffff ffff 3ca9 f45e db60 ffff ffff ffff  ....<..^.`......
	0x0050:  f03d 0008 5365 7469 6373 2032 0108 0204  .=..Setics.2....
	0x0060:  0b16 0c12 1824 3204 3048 606c 2d1a 3009  .....$2.0H`l-.0.
	0x0070:  17ff ffff 0000 0000 0000 0000 0000 0000  ................
	0x0080:  0000 0000 0000 0000 0000                 ..........
13:31:54.042497 ba:27:eb:c6:02:3a (oui Unknown) > b8:27:eb:c6:02:3a (oui Unknown), ethertype Unknown (0x886c), length 144: 
	0x0000:  8001 00ae 0000 1018 0001 0002 0000 0000  ................
	0x0010:  002c 0000 0000 0000 0000 0000 0000 0000  .,..............
	0x0020:  0046 3ca9 f45e db60 776c 3000 0000 0000  .F<..^.`wl0.....
	0x0030:  0000 0000 0000 0000 0000 4000 0000 ffff  ..........@.....
	0x0040:  ffff ffff 3ca9 f45e db60 ffff ffff ffff  ....<..^.`......
	0x0050:  003e 0000 0108 0204 0b16 0c12 1824 3204  .>...........$2.
	0x0060:  3048 606c 2d1a 3009 17ff ffff 0000 0000  0H`l-.0.........
	0x0070:  0000 0000 0000 0000 0000 0000 0000 0000  ................
	0x0080:  0000                                     ..
13:31:54.078129 ba:27:eb:c6:02:3a (oui Unknown) > b8:27:eb:c6:02:3a (oui Unknown), ethertype Unknown (0x886c), length 144: 
	0x0000:  8001 00ae 0000 1018 0001 0002 0000 0000  ................
	0x0010:  002c 0000 0000 0000 0000 0000 0000 0000  .,..............
	0x0020:  0046 3ca9 f45e db60 776c 3000 0000 0000  .F<..^.`wl0.....
	0x0030:  0000 0000 0000 0000 0000 4000 0000 ffff  ..........@.....
	0x0040:  ffff ffff 3ca9 f45e db60 ffff ffff ffff  ....<..^.`......
	0x0050:  203e 0000 0108 0204 0b16 0c12 1824 3204  .>...........$2.
	0x0060:  3048 606c 2d1a 3009 17ff ffff 0000 0000  0H`l-.0.........
	0x0070:  0000 0000 0000 0000 0000 0000 0000 0000  ................
	0x0080:  0000                                     ..
13:31:57.179957 IP 192.168.0.162.36498 > google-public-dns-a.google.com.domain: 57922+ A? www.google.de. (31)
13:31:57.228533 IP google-public-dns-a.google.com.domain > 192.168.0.162.36498: 57922 1/0/0 A 172.217.21.195 (47)
13:31:57.229634 IP 192.168.0.162.53532 > fra16s12-in-f3.1e100.net.http: Flags [S], seq 75216902, win 29200, options [mss 1460,sackOK,TS val 1323606 ecr 0,nop,wscale 7], length 0
13:31:57.258477 IP fra16s12-in-f3.1e100.net.http > 192.168.0.162.53532: Flags [S.], seq 2220307834, ack 75216903, win 42540, options [mss 1430,sackOK,TS val 33265221 ecr 1323606,nop,wscale 7], length 0
13:31:57.258977 IP 192.168.0.162.53532 > fra16s12-in-f3.1e100.net.http: Flags [.], ack 1, win 229, options [nop,nop,TS val 1323609 ecr 33265221], length 0
13:31:57.260161 IP 192.168.0.162.53532 > fra16s12-in-f3.1e100.net.http: Flags [P.], seq 1:550, ack 1, win 229, options [nop,nop,TS val 1323610 ecr 33265221], length 549
13:31:57.295925 IP fra16s12-in-f3.1e100.net.http > 192.168.0.162.53532: Flags [.], ack 550, win 341, options [nop,nop,TS val 33265257 ecr 1323610], length 0
13:31:57.306957 IP fra16s12-in-f3.1e100.net.http > 192.168.0.162.53532: Flags [P.], seq 1:495, ack 550, win 341, options [nop,nop,TS val 33265272 ecr 1323610], length 494
13:31:57.307393 IP 192.168.0.162.53532 > fra16s12-in-f3.1e100.net.http: Flags [.], ack 495, win 237, options [nop,nop,TS val 1323614 ecr 33265272], length 0
13:31:57.335614 IP 192.168.0.162.52078 > fra16s12-in-f3.1e100.net.https: Flags [S], seq 2872183215, win 29200, options [mss 1460,sackOK,TS val 1323617 ecr 0,nop,wscale 7], length 0
13:31:57.368958 IP fra16s12-in-f3.1e100.net.https > 192.168.0.162.52078: Flags [S.], seq 3577956407, ack 2872183216, win 42540, options [mss 1430,sackOK,TS val 67741252 ecr 1323617,nop,wscale 7], length 0
13:31:57.369393 IP 192.168.0.162.52078 > fra16s12-in-f3.1e100.net.https: Flags [.], ack 1, win 229, options [nop,nop,TS val 1323620 ecr 67741252], length 0
13:31:57.371050 IP 192.168.0.162.52078 > fra16s12-in-f3.1e100.net.https: Flags [P.], seq 1:203, ack 1, win 229, options [nop,nop,TS val 1323621 ecr 67741252], length 202
13:31:57.399917 IP fra16s12-in-f3.1e100.net.https > 192.168.0.162.52078: Flags [.], ack 203, win 341, options [nop,nop,TS val 67741283 ecr 1323621], length 0
13:31:57.400301 IP fra16s12-in-f3.1e100.net.https > 192.168.0.162.52078: Flags [.], seq 1:1419, ack 203, win 341, options [nop,nop,TS val 67741284 ecr 1323621], length 1418
13:31:57.400798 IP 192.168.0.162.52078 > fra16s12-in-f3.1e100.net.https: Flags [.], ack 1419, win 251, options [nop,nop,TS val 1323624 ecr 67741284], length 0
13:31:57.401479 IP fra16s12-in-f3.1e100.net.https > 192.168.0.162.52078: Flags [.], seq 1419:2837, ack 203, win 341, options [nop,nop,TS val 67741284 ecr 1323621], length 1418
13:31:57.401532 IP fra16s12-in-f3.1e100.net.https > 192.168.0.162.52078: Flags [P.], seq 2837:3729, ack 203, win 341, options [nop,nop,TS val 67741284 ecr 1323621], length 892
13:31:57.401995 IP 192.168.0.162.52078 > fra16s12-in-f3.1e100.net.https: Flags [.], ack 2837, win 274, options [nop,nop,TS val 1323624 ecr 67741284], length 0
13:31:57.402110 IP 192.168.0.162.52078 > fra16s12-in-f3.1e100.net.https: Flags [.], ack 3729, win 296, options [nop,nop,TS val 1323624 ecr 67741284], length 0
13:31:57.414396 IP 192.168.0.162.52078 > fra16s12-in-f3.1e100.net.https: Flags [P.], seq 203:445, ack 3729, win 296, options [nop,nop,TS val 1323625 ecr 67741284], length 242
13:31:57.445821 IP fra16s12-in-f3.1e100.net.https > 192.168.0.162.52078: Flags [P.], seq 3729:4015, ack 445, win 350, options [nop,nop,TS val 67741326 ecr 1323625], length 286
13:31:57.446005 IP fra16s12-in-f3.1e100.net.https > 192.168.0.162.52078: Flags [P.], seq 4015:4063, ack 445, win 350, options [nop,nop,TS val 67741326 ecr 1323625], length 48
13:31:57.446148 IP fra16s12-in-f3.1e100.net.https > 192.168.0.162.52078: Flags [P.], seq 4063:4097, ack 445, win 350, options [nop,nop,TS val 67741326 ecr 1323625], length 34
13:31:57.460119 IP 192.168.0.162.52078 > fra16s12-in-f3.1e100.net.https: Flags [P.], seq 445:490, ack 4097, win 318, options [nop,nop,TS val 1323630 ecr 67741326], length 45
13:31:57.460264 IP 192.168.0.162.52078 > fra16s12-in-f3.1e100.net.https: Flags [P.], seq 490:532, ack 4097, win 318, options [nop,nop,TS val 1323630 ecr 67741326], length 42
13:31:57.460384 IP 192.168.0.162.52078 > fra16s12-in-f3.1e100.net.https: Flags [P.], seq 532:566, ack 4097, win 318, options [nop,nop,TS val 1323630 ecr 67741326], length 34
13:31:57.461821 IP 192.168.0.162.52078 > fra16s12-in-f3.1e100.net.https: Flags [P.], seq 566:596, ack 4097, win 318, options [nop,nop,TS val 1323630 ecr 67741326], length 30
13:31:57.462393 IP 192.168.0.162.52078 > fra16s12-in-f3.1e100.net.https: Flags [P.], seq 596:998, ack 4097, win 318, options [nop,nop,TS val 1323630 ecr 67741326], length 402
13:31:57.495657 IP fra16s12-in-f3.1e100.net.https > 192.168.0.162.52078: Flags [.], ack 532, win 350, options [nop,nop,TS val 67741379 ecr 1323630], length 0
13:31:57.495802 IP fra16s12-in-f3.1e100.net.https > 192.168.0.162.52078: Flags [P.], seq 4097:4127, ack 532, win 350, options [nop,nop,TS val 67741379 ecr 1323630], length 30
13:31:57.495940 IP fra16s12-in-f3.1e100.net.https > 192.168.0.162.52078: Flags [.], ack 596, win 350, options [nop,nop,TS val 67741381 ecr 1323630], length 0
13:31:57.530021 IP 192.168.0.162.52078 > fra16s12-in-f3.1e100.net.https: Flags [.], ack 4127, win 318, options [nop,nop,TS val 1323637 ecr 67741379], length 0
13:31:57.536984 IP fra16s12-in-f3.1e100.net.https > 192.168.0.162.52078: Flags [.], ack 998, win 358, options [nop,nop,TS val 67741423 ecr 1323630], length 0
13:31:57.566485 IP fra16s12-in-f3.1e100.net.https > 192.168.0.162.52078: Flags [P.], seq 4127:4315, ack 998, win 358, options [nop,nop,TS val 67741450 ecr 1323637], length 188
13:31:57.566730 IP fra16s12-in-f3.1e100.net.https > 192.168.0.162.52078: Flags [P.], seq 4315:5733, ack 998, win 358, options [nop,nop,TS val 67741450 ecr 1323637], length 1418
13:31:57.566909 IP 192.168.0.162.52078 > fra16s12-in-f3.1e100.net.https: Flags [.], ack 4315, win 340, options [nop,nop,TS val 1323640 ecr 67741450], length 0
13:31:57.567192 IP 192.168.0.162.52078 > fra16s12-in-f3.1e100.net.https: Flags [.], ack 5733, win 363, options [nop,nop,TS val 1323640 ecr 67741450], length 0
13:31:57.567457 IP fra16s12-in-f3.1e100.net.https > 192.168.0.162.52078: Flags [P.], seq 5733:7151, ack 998, win 358, options [nop,nop,TS val 67741450 ecr 1323637], length 1418
13:31:57.567906 IP 192.168.0.162.52078 > fra16s12-in-f3.1e100.net.https: Flags [.], ack 7151, win 386, options [nop,nop,TS val 1323640 ecr 67741450], length 0
13:31:57.591976 IP fra16s12-in-f3.1e100.net.https > 192.168.0.162.52078: Flags [.], seq 7151:8569, ack 998, win 358, options [nop,nop,TS val 67741450 ecr 1323637], length 1418
13:31:57.592669 IP fra16s12-in-f3.1e100.net.https > 192.168.0.162.52078: Flags [P.], seq 8569:9987, ack 998, win 358, options [nop,nop,TS val 67741450 ecr 1323637], length 1418
13:31:57.592684 IP 192.168.0.162.52078 > fra16s12-in-f3.1e100.net.https: Flags [.], ack 8569, win 408, options [nop,nop,TS val 1323643 ecr 67741450], length 0
13:31:57.592726 IP fra16s12-in-f3.1e100.net.https > 192.168.0.162.52078: Flags [P.], seq 9987:11405, ack 998, win 358, options [nop,nop,TS val 67741450 ecr 1323637], length 1418
13:31:57.592771 IP fra16s12-in-f3.1e100.net.https > 192.168.0.162.52078: Flags [.], seq 11405:12823, ack 998, win 358, options [nop,nop,TS val 67741450 ecr 1323637], length 1418
13:31:57.592812 IP fra16s12-in-f3.1e100.net.https > 192.168.0.162.52078: Flags [P.], seq 12823:14241, ack 998, win 358, options [nop,nop,TS val 67741450 ecr 1323637], length 1418
13:31:57.592864 IP fra16s12-in-f3.1e100.net.https > 192.168.0.162.52078: Flags [P.], seq 14241:15659, ack 998, win 358, options [nop,nop,TS val 67741450 ecr 1323637], length 1418
13:31:57.593161 IP fra16s12-in-f3.1e100.net.https > 192.168.0.162.52078: Flags [P.], seq 15659:16720, ack 998, win 358, options [nop,nop,TS val 67741450 ecr 1323637], length 1061
13:31:57.593305 IP 192.168.0.162.52078 > fra16s12-in-f3.1e100.net.https: Flags [.], ack 9987, win 431, options [nop,nop,TS val 1323643 ecr 67741450], length 0
13:31:57.593401 IP 192.168.0.162.52078 > fra16s12-in-f3.1e100.net.https: Flags [.], ack 11405, win 453, options [nop,nop,TS val 1323643 ecr 67741450], length 0
13:31:57.593543 IP 192.168.0.162.52078 > fra16s12-in-f3.1e100.net.https: Flags [.], ack 12823, win 476, options [nop,nop,TS val 1323643 ecr 67741450], length 0
13:31:57.593767 IP 192.168.0.162.52078 > fra16s12-in-f3.1e100.net.https: Flags [.], ack 14241, win 499, options [nop,nop,TS val 1323643 ecr 67741450], length 0
13:31:57.593819 IP 192.168.0.162.52078 > fra16s12-in-f3.1e100.net.https: Flags [.], ack 15659, win 521, options [nop,nop,TS val 1323643 ecr 67741450], length 0
13:31:57.593923 IP 192.168.0.162.52078 > fra16s12-in-f3.1e100.net.https: Flags [.], ack 16720, win 543, options [nop,nop,TS val 1323643 ecr 67741450], length 0
13:31:57.596921 IP fra16s12-in-f3.1e100.net.https > 192.168.0.162.52078: Flags [.], seq 16720:18138, ack 998, win 358, options [nop,nop,TS val 67741482 ecr 1323640], length 1418
13:31:57.597568 IP 192.168.0.162.52078 > fra16s12-in-f3.1e100.net.https: Flags [.], ack 18138, win 566, options [nop,nop,TS val 1323643 ecr 67741482], length 0
13:31:57.597954 IP fra16s12-in-f3.1e100.net.https > 192.168.0.162.52078: Flags [.], seq 18138:19556, ack 998, win 358, options [nop,nop,TS val 67741482 ecr 1323640], length 1418
13:31:57.598494 IP 192.168.0.162.52078 > fra16s12-in-f3.1e100.net.https: Flags [.], ack 19556, win 589, options [nop,nop,TS val 1323643 ecr 67741482], length 0
13:31:57.613450 IP fra16s12-in-f3.1e100.net.https > 192.168.0.162.52078: Flags [.], seq 19556:20974, ack 998, win 358, options [nop,nop,TS val 67741498 ecr 1323640], length 1418
13:31:57.614143 IP 192.168.0.162.52078 > fra16s12-in-f3.1e100.net.https: Flags [.], ack 20974, win 611, options [nop,nop,TS val 1323645 ecr 67741498], length 0
13:31:57.614173 IP fra16s12-in-f3.1e100.net.https > 192.168.0.162.52078: Flags [.], seq 20974:22392, ack 998, win 358, options [nop,nop,TS val 67741498 ecr 1323640], length 1418
13:31:57.614732 IP 192.168.0.162.52078 > fra16s12-in-f3.1e100.net.https: Flags [.], ack 22392, win 634, options [nop,nop,TS val 1323645 ecr 67741498], length 0
13:31:57.614909 IP fra16s12-in-f3.1e100.net.https > 192.168.0.162.52078: Flags [.], seq 22392:23810, ack 998, win 358, options [nop,nop,TS val 67741498 ecr 1323640], length 1418
13:31:57.615437 IP 192.168.0.162.52078 > fra16s12-in-f3.1e100.net.https: Flags [.], ack 23810, win 657, options [nop,nop,TS val 1323645 ecr 67741498], length 0
13:31:57.615840 IP fra16s12-in-f3.1e100.net.https > 192.168.0.162.52078: Flags [.], seq 23810:25228, ack 998, win 358, options [nop,nop,TS val 67741498 ecr 1323640], length 1418
13:31:57.616444 IP 192.168.0.162.52078 > fra16s12-in-f3.1e100.net.https: Flags [.], ack 25228, win 679, options [nop,nop,TS val 1323645 ecr 67741498], length 0
13:31:57.618335 IP fra16s12-in-f3.1e100.net.https > 192.168.0.162.52078: Flags [.], seq 25228:26646, ack 998, win 358, options [nop,nop,TS val 67741503 ecr 1323643], length 1418
13:31:57.619099 IP fra16s12-in-f3.1e100.net.https > 192.168.0.162.52078: Flags [.], seq 26646:28064, ack 998, win 358, options [nop,nop,TS val 67741503 ecr 1323643], length 1418
13:31:57.619122 IP 192.168.0.162.52078 > fra16s12-in-f3.1e100.net.https: Flags [.], ack 26646, win 702, options [nop,nop,TS val 1323645 ecr 67741503], length 0
13:31:57.619654 IP 192.168.0.162.52078 > fra16s12-in-f3.1e100.net.https: Flags [.], ack 28064, win 724, options [nop,nop,TS val 1323645 ecr 67741503], length 0
13:31:57.620363 IP fra16s12-in-f3.1e100.net.https > 192.168.0.162.52078: Flags [.], seq 28064:29482, ack 998, win 358, options [nop,nop,TS val 67741503 ecr 1323643], length 1418
13:31:57.621053 IP fra16s12-in-f3.1e100.net.https > 192.168.0.162.52078: Flags [.], seq 29482:30900, ack 998, win 358, options [nop,nop,TS val 67741503 ecr 1323643], length 1418
13:31:57.621074 IP 192.168.0.162.52078 > fra16s12-in-f3.1e100.net.https: Flags [.], ack 29482, win 747, options [nop,nop,TS val 1323646 ecr 67741503], length 0
13:31:57.621615 IP 192.168.0.162.52078 > fra16s12-in-f3.1e100.net.https: Flags [.], ack 30900, win 770, options [nop,nop,TS val 1323646 ecr 67741503], length 0
13:31:57.621880 IP fra16s12-in-f3.1e100.net.https > 192.168.0.162.52078: Flags [.], seq 30900:32318, ack 998, win 358, options [nop,nop,TS val 67741504 ecr 1323643], length 1418
13:31:57.622506 IP 192.168.0.162.52078 > fra16s12-in-f3.1e100.net.https: Flags [.], ack 32318, win 792, options [nop,nop,TS val 1323646 ecr 67741504], length 0
13:31:57.623910 IP fra16s12-in-f3.1e100.net.https > 192.168.0.162.52078: Flags [.], seq 32318:33736, ack 998, win 358, options [nop,nop,TS val 67741504 ecr 1323643], length 1418
13:31:57.624595 IP 192.168.0.162.52078 > fra16s12-in-f3.1e100.net.https: Flags [.], ack 33736, win 815, options [nop,nop,TS val 1323646 ecr 67741504], length 0
13:31:57.625145 IP fra16s12-in-f3.1e100.net.https > 192.168.0.162.52078: Flags [.], seq 33736:35154, ack 998, win 358, options [nop,nop,TS val 67741504 ecr 1323643], length 1418
13:31:57.625758 IP 192.168.0.162.52078 > fra16s12-in-f3.1e100.net.https: Flags [.], ack 35154, win 838, options [nop,nop,TS val 1323646 ecr 67741504], length 0
13:31:57.626404 IP fra16s12-in-f3.1e100.net.https > 192.168.0.162.52078: Flags [P.], seq 35154:36572, ack 998, win 358, options [nop,nop,TS val 67741504 ecr 1323643], length 1418
13:31:57.626456 IP fra16s12-in-f3.1e100.net.https > 192.168.0.162.52078: Flags [.], seq 36572:37990, ack 998, win 358, options [nop,nop,TS val 67741504 ecr 1323643], length 1418
13:31:57.627094 IP 192.168.0.162.52078 > fra16s12-in-f3.1e100.net.https: Flags [.], ack 36572, win 860, options [nop,nop,TS val 1323646 ecr 67741504], length 0
13:31:57.627200 IP 192.168.0.162.52078 > fra16s12-in-f3.1e100.net.https: Flags [.], ack 37990, win 883, options [nop,nop,TS val 1323646 ecr 67741504], length 0
13:31:57.627715 IP fra16s12-in-f3.1e100.net.https > 192.168.0.162.52078: Flags [.], seq 37990:39408, ack 998, win 358, options [nop,nop,TS val 67741504 ecr 1323643], length 1418
13:31:57.627767 IP fra16s12-in-f3.1e100.net.https > 192.168.0.162.52078: Flags [.], seq 39408:40826, ack 998, win 358, options [nop,nop,TS val 67741504 ecr 1323643], length 1418
13:31:57.628014 IP fra16s12-in-f3.1e100.net.https > 192.168.0.162.52078: Flags [.], seq 40826:42244, ack 998, win 358, options [nop,nop,TS val 67741504 ecr 1323643], length 1418
13:31:57.628368 IP fra16s12-in-f3.1e100.net.https > 192.168.0.162.52078: Flags [.], seq 42244:43662, ack 998, win 358, options [nop,nop,TS val 67741506 ecr 1323643], length 1418
13:31:57.628614 IP 192.168.0.162.52078 > fra16s12-in-f3.1e100.net.https: Flags [.], ack 39408, win 905, options [nop,nop,TS val 1323646 ecr 67741504], length 0
13:31:57.628719 IP 192.168.0.162.52078 > fra16s12-in-f3.1e100.net.https: Flags [.], ack 40826, win 928, options [nop,nop,TS val 1323646 ecr 67741504], length 0
13:31:57.628751 IP 192.168.0.162.52078 > fra16s12-in-f3.1e100.net.https: Flags [.], ack 42244, win 951, options [nop,nop,TS val 1323646 ecr 67741504], length 0
13:31:57.628896 IP 192.168.0.162.52078 > fra16s12-in-f3.1e100.net.https: Flags [.], ack 43662, win 973, options [nop,nop,TS val 1323646 ecr 67741506], length 0
13:31:57.630268 IP fra16s12-in-f3.1e100.net.https > 192.168.0.162.52078: Flags [.], seq 43662:45080, ack 998, win 358, options [nop,nop,TS val 67741506 ecr 1323643], length 1418
13:31:57.630322 IP fra16s12-in-f3.1e100.net.https > 192.168.0.162.52078: Flags [.], seq 45080:46498, ack 998, win 358, options [nop,nop,TS val 67741511 ecr 1323643], length 1418
13:31:57.630881 IP fra16s12-in-f3.1e100.net.https > 192.168.0.162.52078: Flags [.], seq 46498:47916, ack 998, win 358, options [nop,nop,TS val 67741511 ecr 1323643], length 1418
13:31:57.631074 IP 192.168.0.162.52078 > fra16s12-in-f3.1e100.net.https: Flags [.], ack 45080, win 996, options [nop,nop,TS val 1323647 ecr 67741506], length 0
13:31:57.631126 IP 192.168.0.162.52078 > fra16s12-in-f3.1e100.net.https: Flags [.], ack 46498, win 1019, options [nop,nop,TS val 1323647 ecr 67741511], length 0
13:31:57.631314 IP 192.168.0.162.52078 > fra16s12-in-f3.1e100.net.https: Flags [.], ack 47916, win 1041, options [nop,nop,TS val 1323647 ecr 67741511], length 0
13:31:57.634759 IP fra16s12-in-f3.1e100.net.https > 192.168.0.162.52078: Flags [.], seq 47916:49334, ack 998, win 358, options [nop,nop,TS val 67741512 ecr 1323643], length 1418
13:31:57.635429 IP 192.168.0.162.52078 > fra16s12-in-f3.1e100.net.https: Flags [.], ack 49334, win 1064, options [nop,nop,TS val 1323647 ecr 67741512], length 0
13:31:57.635458 IP fra16s12-in-f3.1e100.net.https > 192.168.0.162.52078: Flags [.], seq 49334:50752, ack 998, win 358, options [nop,nop,TS val 67741512 ecr 1323643], length 1418
13:31:57.636066 IP 192.168.0.162.52078 > fra16s12-in-f3.1e100.net.https: Flags [.], ack 50752, win 1086, options [nop,nop,TS val 1323647 ecr 67741512], length 0
13:31:57.642784 IP fra16s12-in-f3.1e100.net.https > 192.168.0.162.52078: Flags [.], seq 50752:52170, ack 998, win 358, options [nop,nop,TS val 67741525 ecr 1323645], length 1418
13:31:57.643029 IP fra16s12-in-f3.1e100.net.https > 192.168.0.162.52078: Flags [.], seq 52170:53588, ack 998, win 358, options [nop,nop,TS val 67741525 ecr 1323645], length 1418
13:31:57.643527 IP 192.168.0.162.52078 > fra16s12-in-f3.1e100.net.https: Flags [.], ack 52170, win 1109, options [nop,nop,TS val 1323648 ecr 67741525], length 0
13:31:57.643723 IP 192.168.0.162.52078 > fra16s12-in-f3.1e100.net.https: Flags [.], ack 53588, win 1132, options [nop,nop,TS val 1323648 ecr 67741525], length 0
13:31:57.644293 IP fra16s12-in-f3.1e100.net.https > 192.168.0.162.52078: Flags [.], seq 53588:55006, ack 998, win 358, options [nop,nop,TS val 67741525 ecr 1323645], length 1418
13:31:57.644346 IP fra16s12-in-f3.1e100.net.https > 192.168.0.162.52078: Flags [.], seq 55006:56424, ack 998, win 358, options [nop,nop,TS val 67741525 ecr 1323645], length 1418
13:31:57.645117 IP 192.168.0.162.52078 > fra16s12-in-f3.1e100.net.https: Flags [.], ack 55006, win 1154, options [nop,nop,TS val 1323648 ecr 67741525], length 0
13:31:57.645213 IP 192.168.0.162.52078 > fra16s12-in-f3.1e100.net.https: Flags [.], ack 56424, win 1177, options [nop,nop,TS val 1323648 ecr 67741525], length 0
13:31:57.645834 IP fra16s12-in-f3.1e100.net.https > 192.168.0.162.52078: Flags [.], seq 56424:57842, ack 998, win 358, options [nop,nop,TS val 67741526 ecr 1323645], length 1418
13:31:57.646391 IP fra16s12-in-f3.1e100.net.https > 192.168.0.162.52078: Flags [.], seq 57842:59260, ack 998, win 358, options [nop,nop,TS val 67741526 ecr 1323645], length 1418
13:31:57.646444 IP fra16s12-in-f3.1e100.net.https > 192.168.0.162.52078: Flags [.], seq 59260:60678, ack 998, win 358, options [nop,nop,TS val 67741527 ecr 1323645], length 1418
13:31:57.646696 IP fra16s12-in-f3.1e100.net.https > 192.168.0.162.52078: Flags [.], seq 60678:62096, ack 998, win 358, options [nop,nop,TS val 67741527 ecr 1323645], length 1418
13:31:57.646708 IP 192.168.0.162.52078 > fra16s12-in-f3.1e100.net.https: Flags [.], ack 57842, win 1200, options [nop,nop,TS val 1323648 ecr 67741526], length 0
13:31:57.647507 IP fra16s12-in-f3.1e100.net.https > 192.168.0.162.52078: Flags [.], seq 62096:63514, ack 998, win 358, options [nop,nop,TS val 67741529 ecr 1323645], length 1418
13:31:57.647568 IP 192.168.0.162.52078 > fra16s12-in-f3.1e100.net.https: Flags [.], ack 59260, win 1222, options [nop,nop,TS val 1323648 ecr 67741526], length 0
13:31:57.647659 IP 192.168.0.162.52078 > fra16s12-in-f3.1e100.net.https: Flags [.], ack 60678, win 1245, options [nop,nop,TS val 1323648 ecr 67741527], length 0
13:31:57.647715 IP 192.168.0.162.52078 > fra16s12-in-f3.1e100.net.https: Flags [.], ack 62096, win 1267, options [nop,nop,TS val 1323648 ecr 67741527], length 0
13:31:57.647928 IP fra16s12-in-f3.1e100.net.https > 192.168.0.162.52078: Flags [.], seq 63514:64932, ack 998, win 358, options [nop,nop,TS val 67741529 ecr 1323645], length 1418
13:31:57.648123 IP 192.168.0.162.52078 > fra16s12-in-f3.1e100.net.https: Flags [.], ack 63514, win 1290, options [nop,nop,TS val 1323648 ecr 67741529], length 0
13:31:57.648500 IP 192.168.0.162.52078 > fra16s12-in-f3.1e100.net.https: Flags [.], ack 64932, win 1313, options [nop,nop,TS val 1323648 ecr 67741529], length 0
13:31:57.648718 IP fra16s12-in-f3.1e100.net.https > 192.168.0.162.52078: Flags [.], seq 64932:66350, ack 998, win 358, options [nop,nop,TS val 67741531 ecr 1323645], length 1418
13:31:57.649346 IP fra16s12-in-f3.1e100.net.https > 192.168.0.162.52078: Flags [.], seq 66350:67768, ack 998, win 358, options [nop,nop,TS val 67741531 ecr 1323645], length 1418
13:31:57.649372 IP 192.168.0.162.52078 > fra16s12-in-f3.1e100.net.https: Flags [.], ack 66350, win 1324, options [nop,nop,TS val 1323648 ecr 67741531], length 0
